{
  "api_version": "experiments.fips.network/reproduction-bundle/v1alpha1",
  "bundle_id": "bundle-d2a75bd7afb985f4cedc43dc5f319f08",
  "normalized_plan": {
    "api_version": "experiments.fips.network/normalized-plan/v1alpha1",
    "axes": [],
    "campaign": {
      "accounting": {
        "causal_lineage": true,
        "network_overhead": "configured",
        "reconcile_serialized_frames": true,
        "transport_overhead": true
      },
      "apiVersion": "experiments.fips.network/v1alpha1",
      "assertions": [
        {
          "eventually": {
            "after_input_quiescence": {
              "nanoseconds": 30000000000
            },
            "condition": "all_connected_nodes_agree_on_minimum_root"
          }
        },
        {
          "always": {
            "condition": "no_forwarding_loops"
          }
        },
        {
          "eventually": {
            "condition": "data_plane_makes_progress"
          }
        },
        {
          "reconcile": {
            "condition": "measured_bytes_equal_serialized_frames"
          }
        },
        {
          "deterministic": {
            "condition": "same_seed_same_event_order_and_result"
          }
        }
      ],
      "engine": {
        "deterministic": true,
        "modes": "compact-discrete-event",
        "variant": "fips-80c956a-baseline"
      },
      "events": [
        {
          "action": "introduce-lower-root-identities",
          "id": "descending-root-arrivals"
        }
      ],
      "fidelity": {
        "billion_node_representation": "not-requested",
        "bloom": "exact-bits",
        "crypto": "operation-count",
        "protocol": "semantic-exact",
        "serialization": "executable-codec"
      },
      "identities": {
        "arrivals": {
          "address_policy": "strictly-lower-than-current-root",
          "attachment": "current-root",
          "attacker_budget": {
            "identities": 4,
            "mode": "bounded",
            "operations": 4
          },
          "count": 4,
          "schedule": {
            "interval": {
              "nanoseconds": 499000000
            },
            "start": {
              "nanoseconds": 2000000000
            }
          }
        },
        "initial": {
          "distribution": "uniform-128"
        }
      },
      "instrumentation": {
        "causal_cost_ledger": true,
        "control_and_useful_bytes": true,
        "queue_wait": true,
        "quiescence_markers": [
          "root",
          "tree",
          "bloom",
          "lookup",
          "data-plane"
        ],
        "root_agreement_by_depth": true,
        "transition_stages": true
      },
      "kind": "Campaign",
      "links": {
        "bandwidth_bps": 10000000,
        "drop_policy": "tail-drop",
        "duplication_ppm": 0,
        "latency": {
          "nanoseconds": 1000000
        },
        "loss_ppm": 0,
        "mtu_bytes": 1500,
        "ordering": "stream",
        "queue_bytes": 1048576
      },
      "metadata": {
        "description": "M2 coupled Bloom, cache, lookup, resource, and useful-traffic recovery",
        "name": "root-ratchet-recovery"
      },
      "objectives": {
        "maximize": [
          "control_bytes_per_root_arrival",
          "data_plane_stall_duration",
          "coordinate_cache_invalidations"
        ]
      },
      "protocol": {
        "parameters": {
          "bloom_max_fpr_ppm": 200000,
          "bloom_update_debounce": {
            "nanoseconds": 500000000
          },
          "coord_cache_entries": 8,
          "coord_cache_ttl": {
            "nanoseconds": 5000000000
          },
          "lookup_attempts": 3,
          "lookup_ttl": 64,
          "tree_announce_debounce": {
            "nanoseconds": 500000000
          }
        },
        "variant": "fips-80c956a-baseline"
      },
      "resources": {
        "assignment": "heterogeneous",
        "node_profiles": [
          {
            "cpu_units": 1000,
            "memory_bytes": 1073741824,
            "name": "baseline",
            "queue_bytes": 1048576,
            "table_entries": 1000
          }
        ]
      },
      "scale": {
        "nodes": 12
      },
      "seed": 424242,
      "topology": {
        "average_degree": 2,
        "connected": true,
        "generator": "chain"
      },
      "traffic": {
        "model": "uniform-random",
        "parameters": {
          "flow_count": 48
        },
        "payload_bytes": 512,
        "rate_bps": 40960
      },
      "transports": {
        "assignment": "all-udp"
      }
    },
    "campaign_sha256": "42541b80f010f26a0ee904e212ebbbeeb35bdacbc2a0ce3632461a34c890caed",
    "seed": 424242
  },
  "seed": 424242,
  "engine": "fips-individual-reference",
  "variant": "fips-80c956a-baseline",
  "fidelity": {
    "wire": "executable-codec",
    "protocol": "semantic-exact",
    "compute": "operation-counted",
    "scale": "individual",
    "bloom": "exact-bits",
    "represented_nodes": 12,
    "approximations": [],
    "sampled_regions": []
  },
  "provenance": {
    "engine_name": "fips-individual-reference",
    "engine_version": "m2-v1",
    "engine_source_revision": "fecd252d1e0dda6cc2ea4be05fe191bc7ef9cb29",
    "schema_versions": {
      "normalized-plan": "experiments.fips.network/normalized-plan/v1alpha1",
      "reproduction-bundle": "experiments.fips.network/reproduction-bundle/v1alpha1",
      "run-artifact": "experiments.fips.network/run-artifact/v1alpha1"
    },
    "seed": 424242,
    "normalized_plan_sha256": "c855a48b0380ce1ddff72ded27afc421da8f88f048b9a5eb4bc05952b141a46f",
    "fips_commit": "80c956a6fdb85dde1450969a21891c1158e43267",
    "image_digest": null,
    "hardware_profile": null
  },
  "expected_assertions": [
    "root-agreement",
    "loop-freedom",
    "no-obsolete-root-retention",
    "per-peer-debounce",
    "coordinate-consistency",
    "control-queues-return-to-baseline",
    "tree-lifecycle-reconciliation",
    "byte-reconciliation",
    "deterministic-total-order",
    "bloom-replacement-reconciliation",
    "causal-ledger-frame-reconciliation",
    "cache-invalidation-scope",
    "continuous-control-eventual-data-progress",
    "modeled-work-has-resource-receipts"
  ],
  "external_blobs": []
}
