{
  "api_version": "experiments.fips.network/reproduction-bundle/v1alpha1",
  "bundle_id": "bundle-587f4c2d7f2f997a89b0e7f72c7bc0d2",
  "normalized_plan": {
    "api_version": "experiments.fips.network/normalized-plan/v1alpha1",
    "axes": [],
    "campaign": {
      "accounting": {
        "causal_lineage": true,
        "network_overhead": "configured",
        "reconcile_serialized_frames": true,
        "transport_overhead": true
      },
      "adversaries": {
        "actions": [
          "bounded-root-grinding",
          "strategic-attachment"
        ],
        "budgets": {
          "identities": 4,
          "operations": 4
        },
        "mode": "authenticated-protocol-valid"
      },
      "apiVersion": "experiments.fips.network/v1alpha1",
      "assertions": [
        {
          "always": {
            "condition": "no_forwarding_loops"
          }
        },
        {
          "eventually": {
            "condition": "data_plane_makes_progress"
          }
        },
        {
          "reconcile": {
            "condition": "measured_bytes_equal_serialized_frames"
          }
        }
      ],
      "engine": {
        "deterministic": true,
        "modes": "compact-discrete-event",
        "variant": "fips-80c956a-baseline"
      },
      "events": [
        {
          "action": "introduce-lower-root-identities",
          "id": "descending-root-arrivals"
        }
      ],
      "fidelity": {
        "billion_node_representation": "not-requested",
        "bloom": "exact-bits",
        "crypto": "operation-count",
        "protocol": "semantic-exact",
        "serialization": "executable-codec"
      },
      "identities": {
        "arrivals": {
          "address_policy": "strictly-lower-than-current-root",
          "attachment": "current-root",
          "attacker_budget": {
            "identities": 4,
            "mode": "bounded",
            "operations": 4
          },
          "count": 1,
          "schedule": {
            "interval": {
              "nanoseconds": 1
            },
            "start": {
              "nanoseconds": 2000000000
            }
          }
        },
        "initial": {
          "distribution": "uniform-128"
        }
      },
      "instrumentation": {
        "causal_cost_ledger": true,
        "control_and_useful_bytes": true,
        "queue_wait": true,
        "quiescence_markers": [
          "root",
          "tree",
          "bloom",
          "lookup",
          "data-plane"
        ],
        "root_agreement_by_depth": true,
        "transition_stages": true
      },
      "kind": "Campaign",
      "links": {
        "bandwidth_bps": 10000000,
        "drop_policy": "tail-drop",
        "duplication_ppm": 0,
        "latency": {
          "nanoseconds": 1000000
        },
        "loss_ppm": 0,
        "mtu_bytes": 1500,
        "ordering": "stream",
        "queue_bytes": 1048576
      },
      "metadata": {
        "description": "M3 authenticated Root Ratchet search and shrink matrix",
        "name": "root-ratchet-search"
      },
      "objectives": {
        "constraints": [
          "/scale/nodes <= 12"
        ],
        "maximize": [
          "control_bytes_per_root_arrival",
          "data_plane_stall_duration"
        ]
      },
      "protocol": {
        "parameters": {},
        "variant": "fips-80c956a-baseline"
      },
      "resources": {
        "assignment": "uniform",
        "node_profiles": [
          {
            "cpu_units": 1000,
            "memory_bytes": 1073741824,
            "name": "baseline",
            "queue_bytes": 1048576,
            "table_entries": 1000
          }
        ]
      },
      "scale": {
        "nodes": 6
      },
      "seed": 7331,
      "topology": {
        "average_degree": 1,
        "connected": true,
        "generator": "chain"
      },
      "traffic": {
        "model": "session-churn",
        "parameters": {
          "flow_count": 1
        },
        "payload_bytes": 1,
        "rate_bps": 40960
      },
      "transports": {
        "assignment": "all-udp"
      }
    },
    "campaign_sha256": "d1c3a63f99402785df388ed48c6b841ffa1d3d1fb5b06a4fbd34cc75caf708e0",
    "seed": 7331
  },
  "seed": 7331,
  "engine": "fips-individual-reference",
  "variant": "fips-80c956a-baseline",
  "fidelity": {
    "wire": "executable-codec",
    "protocol": "semantic-exact",
    "compute": "operation-counted",
    "scale": "individual",
    "bloom": "exact-bits",
    "represented_nodes": 6,
    "approximations": [],
    "sampled_regions": []
  },
  "provenance": {
    "engine_name": "fips-individual-reference",
    "engine_version": "m2-v1",
    "engine_source_revision": "d0466d2951861b24ea2ea7c21da9f78e5f7415c6",
    "schema_versions": {
      "normalized-plan": "experiments.fips.network/normalized-plan/v1alpha1",
      "reproduction-bundle": "experiments.fips.network/reproduction-bundle/v1alpha1",
      "run-artifact": "experiments.fips.network/run-artifact/v1alpha1"
    },
    "seed": 7331,
    "normalized_plan_sha256": "6699c183029a6702dc89f44624b584b8600ac6f0261386f66386a346d3c019a2",
    "fips_commit": "80c956a6fdb85dde1450969a21891c1158e43267",
    "image_digest": null,
    "hardware_profile": null
  },
  "expected_assertions": [
    "root-agreement",
    "loop-freedom",
    "no-obsolete-root-retention",
    "per-peer-debounce",
    "coordinate-consistency",
    "control-queues-return-to-baseline",
    "tree-lifecycle-reconciliation",
    "byte-reconciliation",
    "deterministic-total-order",
    "bloom-replacement-reconciliation",
    "causal-ledger-frame-reconciliation",
    "cache-invalidation-scope",
    "continuous-control-eventual-data-progress",
    "modeled-work-has-resource-receipts"
  ],
  "external_blobs": []
}
