{
  "api_version": "experiments.fips.network/reproduction-bundle/v1alpha1",
  "bundle_id": "bundle-b52b4a78dc1ec89fd733e9bbb06396ce",
  "normalized_plan": {
    "api_version": "experiments.fips.network/normalized-plan/v1alpha1",
    "axes": [],
    "campaign": {
      "accounting": {
        "causal_lineage": true,
        "network_overhead": "configured",
        "reconcile_serialized_frames": true,
        "transport_overhead": true
      },
      "apiVersion": "experiments.fips.network/v1alpha1",
      "assertions": [
        {
          "eventually": {
            "after_input_quiescence": {
              "nanoseconds": 30000000000
            },
            "condition": "all_connected_nodes_agree_on_minimum_root"
          }
        },
        {
          "always": {
            "condition": "no_forwarding_loops"
          }
        },
        {
          "always": {
            "condition": "per_peer_announcements_obey_debounce"
          }
        },
        {
          "reconcile": {
            "condition": "measured_bytes_equal_serialized_frames"
          }
        },
        {
          "deterministic": {
            "condition": "same_seed_same_event_order_and_result"
          }
        }
      ],
      "engine": {
        "deterministic": true,
        "modes": "compact-discrete-event",
        "variant": "fips-80c956a-baseline"
      },
      "events": [
        {
          "action": "introduce-lower-root-identities",
          "id": "descending-root-arrivals"
        }
      ],
      "fidelity": {
        "billion_node_representation": "not-requested",
        "bloom": "exact-bits",
        "crypto": "operation-count",
        "protocol": "semantic-exact",
        "serialization": "executable-codec"
      },
      "identities": {
        "arrivals": {
          "address_policy": "strictly-lower-than-current-root",
          "attachment": "current-root",
          "attacker_budget": {
            "identities": 4,
            "mode": "bounded",
            "operations": 4
          },
          "count": 4,
          "schedule": {
            "interval": {
              "nanoseconds": 499000000
            },
            "start": {
              "nanoseconds": 2000000000
            }
          }
        },
        "initial": {
          "distribution": "uniform-128"
        }
      },
      "instrumentation": {
        "causal_cost_ledger": true,
        "control_and_useful_bytes": true,
        "queue_wait": true,
        "quiescence_markers": [
          "root",
          "tree"
        ],
        "root_agreement_by_depth": true,
        "transition_stages": true
      },
      "kind": "Campaign",
      "links": {
        "bandwidth_bps": 100000000,
        "drop_policy": "tail-drop",
        "duplication_ppm": 0,
        "latency": {
          "nanoseconds": 1000000
        },
        "loss_ppm": 0,
        "mtu_bytes": 9000,
        "ordering": "stream",
        "queue_bytes": 1048576
      },
      "metadata": {
        "description": "M1 deterministic descending-root ladder with four arrivals",
        "name": "root-ratchet-12"
      },
      "objectives": {
        "maximize": [
          "control_bytes_per_root_arrival"
        ]
      },
      "protocol": {
        "parameters": {
          "parent_hold_down": {
            "nanoseconds": 0
          },
          "parent_hysteresis_ppm": 0,
          "tree_announce_debounce": {
            "nanoseconds": 500000000
          }
        },
        "variant": "fips-80c956a-baseline"
      },
      "resources": {
        "assignment": "uniform",
        "node_profiles": [
          {
            "cpu_units": 1000,
            "memory_bytes": 1073741824,
            "name": "baseline",
            "queue_bytes": 1048576,
            "table_entries": 100000
          }
        ]
      },
      "scale": {
        "nodes": 12
      },
      "seed": 424242,
      "topology": {
        "average_degree": 2,
        "connected": true,
        "generator": "chain"
      },
      "traffic": {
        "model": "idle"
      },
      "transports": {
        "assignment": "all-udp"
      }
    },
    "campaign_sha256": "7c5f58bd69b3071a64522e81b01d551e8c14dea156eba3d6738011ed30beb74d",
    "seed": 424242
  },
  "seed": 424242,
  "engine": "fips-individual-reference",
  "variant": "fips-80c956a-baseline",
  "fidelity": {
    "wire": "executable-codec",
    "protocol": "semantic-exact",
    "compute": "operation-counted",
    "scale": "individual",
    "bloom": "exact-bits",
    "represented_nodes": 12,
    "approximations": [],
    "sampled_regions": []
  },
  "provenance": {
    "engine_name": "fips-individual-reference",
    "engine_version": "m1-v1",
    "engine_source_revision": "4bed20fc5129d6afe417cde41e24971b09e5c330",
    "schema_versions": {
      "normalized-plan": "experiments.fips.network/normalized-plan/v1alpha1",
      "reproduction-bundle": "experiments.fips.network/reproduction-bundle/v1alpha1",
      "run-artifact": "experiments.fips.network/run-artifact/v1alpha1"
    },
    "seed": 424242,
    "normalized_plan_sha256": "6f5ba11e22517ce3dc65dff8007ac438afe3f229853b4e10a8172c26496e915c",
    "fips_commit": "80c956a6fdb85dde1450969a21891c1158e43267",
    "image_digest": null,
    "hardware_profile": null
  },
  "expected_assertions": [
    "root-agreement",
    "loop-freedom",
    "no-obsolete-root-retention",
    "per-peer-debounce",
    "coordinate-consistency",
    "control-queues-return-to-baseline",
    "tree-lifecycle-reconciliation",
    "byte-reconciliation",
    "deterministic-total-order"
  ],
  "external_blobs": []
}
